{
  "metadata": {
    "language": "pl",
    "template_id": "basic_resume_v1"
  },
  "basics": {
    "name": "Jan Kowalski",
    "title": "Specjalista ds. operacji i obsługi klienta",
    "targetRole": "Koordynator zespołu obsługi klienta",
    "targetCompany": "Firmy usługowe i e-commerce",
    "targetJobDescription": "",
    "email": "jan.kowalski@example.com",
    "phone": "+48 500 600 700",
    "location": "Polska, Warszawa / Zdalnie",
    "city": "Warszawa",
    "country": "Polska",
    "remoteFriendly": true,
    "urls": {
      "linkedin": "linkedin.com/in/jankowalski-dev",
      "github": "github.com/jankowalski",
      "portfolio": "jankowalski.dev"
    },
    "summary": "Specjalista ds. operacji i obsługi klienta z ponad 6-letnim doświadczeniem w pracy z klientami biznesowymi, reklamacjami i usprawnianiem procesów. Łączy praktyczną znajomość systemów CRM, analizy danych i koordynacji międzyzespołowej z udokumentowanymi efektami w skracaniu czasu obsługi oraz poprawie jakości raportowania."
  },
  "experience": [
    {
      "company": "CloudScale Solutions",
      "position": "Koordynator ds. operacji klienta",
      "location": "Warszawa / Hybrydowo",
      "startDate": "2022-03",
      "endDate": "obecnie",
      "responsibilities": [
        "Koordynacja zgłoszeń klientów biznesowych w systemie CRM i współpraca z zespołami sprzedaży, finansów oraz logistyki.",
        "Przygotowywanie raportów operacyjnych, analiza przyczyn opóźnień i rekomendowanie usprawnień procesu obsługi."
      ],
      "highlights": [
        "Skrócił średni czas obsługi reklamacji z 5 do 2 dni roboczych dzięki uporządkowaniu priorytetów i wdrożeniu szablonów odpowiedzi.",
        "Zwiększył terminowość realizacji zgłoszeń z 82% do 94% przez cotygodniową analizę przyczyn opóźnień i lepsze przekazywanie spraw między działami.",
        "Przygotował dashboard raportowy w Excelu, który ograniczył ręczne raportowanie z 3 godzin do 35 minut tygodniowo."
      ]
    },
    {
      "company": "FinTech Innovations Sp. z o.o.",
      "position": "Specjalista ds. obsługi klienta biznesowego",
      "location": "Kraków",
      "startDate": "2019-07",
      "endDate": "2022-02",
      "responsibilities": [
        "Obsługa zapytań klientów, weryfikacja dokumentów i koordynacja spraw wymagających udziału działu ryzyka.",
        "Prowadzenie dokumentacji spraw w CRM oraz przygotowywanie podsumowań dla przełożonych."
      ],
      "highlights": [
        "Utrzymał średnią ocenę satysfakcji klienta na poziomie 4.8/5 przez 6 kolejnych kwartałów.",
        "Ograniczył liczbę powtarzających się pytań o 22% po przygotowaniu bazy odpowiedzi dla najczęstszych spraw.",
        "Wsparł wdrożenie nowego procesu weryfikacji dokumentów, skracając czas akceptacji spraw o 30%."
      ]
    },
    {
      "company": "StartUp Labs",
      "position": "Asystent biura obsługi",
      "location": "Warszawa",
      "startDate": "2018-06",
      "endDate": "2019-06",
      "responsibilities": [
        "Rejestrowanie zgłoszeń klientów, uzupełnianie dokumentacji i wsparcie administracyjne zespołu."
      ],
      "highlights": [
        "Uporządkował bazę kontaktów obejmującą ponad 2 000 rekordów, poprawiając kompletność danych kontaktowych.",
        "Przygotował prosty szablon raportu dziennego, który ujednolicił przekazywanie informacji między zmianami."
      ]
    }
  ],
  "education": [
    {
      "institution": "Politechnika Warszawska",
      "degree": "Magister",
      "field": "Zarządzanie",
      "location": "Warszawa",
      "startDate": "2018-10",
      "endDate": "2020-06",
      "gpa": "4.8 / 5.0",
      "coursework": ["Analiza procesów biznesowych", "Zarządzanie projektami", "Finanse przedsiębiorstw"]
    },
    {
      "institution": "Politechnika Warszawska",
      "degree": "Licencjat",
      "field": "Administracja",
      "location": "Warszawa",
      "startDate": "2015-10",
      "endDate": "2018-06",
      "coursework": ["Prawo administracyjne", "Komunikacja w organizacji"]
    }
  ],
  "skills": [
    {
      "category": "Kompetencje Branżowe",
      "keywords": ["obsługa klienta B2B", "reklamacje", "koordynacja zgłoszeń", "raportowanie operacyjne"]
    },
    {
      "category": "Narzędzia i Systemy",
      "keywords": ["Excel", "Google Sheets", "Salesforce CRM", "Jira Service Management", "PowerPoint", "systemy ticketowe"]
    },
    {
      "category": "Metodyki i Procesy",
      "keywords": ["SLA", "mapowanie procesów", "analiza przyczyn źródłowych", "onboarding klienta"]
    },
    {
      "category": "Analiza i Raportowanie",
      "keywords": ["tabele przestawne", "dashboardy operacyjne", "analiza trendów", "raporty tygodniowe"]
    }
  ],
  "projects": [
    {
      "name": "Usprawnienie procesu obsługi reklamacji",
      "role": "Koordynator projektu",
      "organization": "CloudScale Solutions",
      "startDate": "2023-04-01",
      "endDate": "2023-08-31",
      "period": "2023-04-01 - 2023-08-31",
      "description": "Projekt uporządkowania sposobu przyjmowania, kategoryzowania i zamykania reklamacji klientów biznesowych.",
      "url": "",
      "keywords": ["SLA", "CRM", "Excel", "reklamacje", "mapowanie procesów"],
      "highlights": [
        "Skrócenie średniego czasu zamknięcia reklamacji z 5 do 2 dni roboczych.",
        "Przygotowanie szablonów odpowiedzi i checklisty przekazania spraw dla 8-osobowego zespołu."
      ]
    },
    {
      "name": "Dashboard tygodniowych wyników operacyjnych",
      "role": "Autor raportu",
      "organization": "projekt wewnętrzny",
      "startDate": "2022-10-01",
      "endDate": "2022-12-31",
      "period": "2022-10-01 - 2022-12-31",
      "description": "Raport w arkuszu kalkulacyjnym pokazujący liczbę zgłoszeń, opóźnienia, przyczyny eskalacji i obciążenie zespołu.",
      "url": "",
      "keywords": ["Excel", "tabele przestawne", "raportowanie", "analiza danych"],
      "highlights": [
        "Ograniczenie ręcznego przygotowania raportu z 3 godzin do 35 minut tygodniowo."
      ]
    }
  ],
  "languages": [
    {
      "language": "Język Polski",
      "fluency": "Native or bilingual proficiency"
    },
    {
      "language": "Język Angielski",
      "fluency": "Full professional proficiency",
      "certificate": "IELTS 7.5"
    }
  ],
  "certifications": [
    {
      "name": "PRINCE2 Foundation",
      "issuer": "PeopleCert",
      "date": "2023-08",
      "expires": "bezterminowo",
      "status": "aktywny",
      "details": "Podstawy prowadzenia projektów, role projektowe, etapy i kontrola postępów."
    },
    {
      "name": "Excel - analiza danych w biznesie",
      "issuer": "Akademia Online",
      "date": "2022-11",
      "status": "ukończony",
      "details": "Tabele przestawne, funkcje wyszukiwania, podstawy dashboardów i raportowania."
    }
  ]
}
